Text,Stance,Sentiment,Target
"satan is busy , but god is in control # god # spiritual # motivation # relax # noworries # strength # semst",AGAINST,Positive,atheism
"mary , most sorrowful , mother of christians , pray for us . # catholic # semst",AGAINST,Positive,atheism
greater is he who is in you than he who is in the world . - 1john 4:4 # god # bible # semst,AGAINST,Positive,atheism
"@ questiontime amber rudd is a joke , trying too much to espouse # thatcherism . # greece # band aid , help our own , be a human being , # semst",NONE,Negative,atheism
it 's # prayertime ! call in 7am friday 605-475-3220 access code : 685783 # prayforcharleston # prayforusa # atlprayer # thelifeline # semst,AGAINST,Positive,atheism
"rt @ prayerbullets : lord , bless my latter end more than my beginning -job 42:12 # semst",AGAINST,Positive,atheism
"rt @ smarfreedom : # pray for orphans in # northkorea , who over the years found themselves homeless. # teamjesustweeters # semst",AGAINST,Positive,atheism
rt @ prayerbullets : i command all spirits of addiction to come out of my appetite in the name of jesus . # semst,AGAINST,Positive,atheism
"# god , because you hold us close , give us the courage to let go when we need to . # semst",AGAINST,Positive,atheism
for the # oppression of the # poor for the sighing of the # needy now will i arise . # psalms 12:5 # bible # god # semst,AGAINST,Positive,atheism
@ michaelshermer praying is ignorance . there 's no god . loving is what matters & it requires honesty . we must conserve h20 ! # drought # semst,FAVOR,Other,atheism
rt @ chasenme01 : ye are the light of the world . a city that is set on an hill can not be hid . matthew 5:14 # shine # belight # semst,AGAINST,Positive,atheism
thou shall think for ones self . # freethought # freethinker # reality # semst,FAVOR,Positive,atheism
@ julievila and it 's almost the end ! ! ! # homeschool # curriculum # semst,NONE,Other,atheism
"for no one can lay any foundation other than the one that has been laid , that foundation is # christ . # semst",AGAINST,Positive,atheism
"if current trend of constitution making continues , indigenous peoples would more than madhesis- hachhethu # identity # inclusion # semst",NONE,Negative,atheism
indigenous would lose more than madhesi if da current trend of constitution making continues- hachhethu # identity # federalism # semst,NONE,Negative,atheism
' i 'm looking for a seed who would stand for identity forever'- hachhethu # federalism # identity # semst,NONE,Positive,atheism
"i will dwell in a peaceful habitation , in secure dwellings , and in quiet resting places -isa . 32:18 # semst",AGAINST,Positive,atheism
all the you 've given . all the ways you 've made . the fact that i 'm still living ! ! how dare i wear on my face . i 'll # lyrictweet # semst,NONE,Negative,atheism
@ wordsporns @ thecomedyhumor . i 'd rather go to hell then worship some image created by whites ... # semst,FAVOR,Negative,atheism
"i bought the world and sold my heart , you traded heaven to have me again . # semst",AGAINST,Positive,atheism
@ rozrothstein only answer to the # israel/ # palestine problem is a # singlesecularstate with a huge emphasis on # semst,NONE,Negative,atheism
therefore iwilllook unto thelord ; iwill wait for the god of my salvation : my godwillhear me . micah 7:7 # tcot # pjnet # ccot # semst,AGAINST,Positive,atheism
"rt @ nikeadeyemi : faithfulness actually means 'full of faith ' . beyond service and commitment , your heart shld be full of faith . # rwatl # semst",AGAINST,Positive,atheism
"i bind and cast out every spirit of the desert owl , fox , dragon , hyena , and vulture in the name of jesus -isa . 34:1115 # semst",AGAINST,Negative,atheism
countless more will die until this race will die by self inflicted genocide # kuwait # shunpoliticalislam # semst,NONE,Negative,atheism
rt @ maggieardiente : humanist love to everyone at # 100aeuassembly celebrating @ ethicalunion 100th anniversary ! amazing ! # ethicalcu ... # semst,NONE,Positive,atheism
"what happened to this world ! attacks in france , tunisia and kuwait kill dozens ! ! is this what you do in ramadan ! ! ! ! ? # shameless # semst",NONE,Negative,atheism
i have never been more dismayed for the future of # america than today . we have forgotten why we 're here to begin with . # freedom # semst,NONE,Negative,atheism
"it 's been a really , really bad week for bigots . # lgbt # equality # nondiscrimination # semst",NONE,Negative,atheism
the far right wing is imploding and they ca n't understand why . too funny . # scotusmarriage # pot # healthcare # semst,NONE,Negative,atheism
"small steps eradicating bigotry : remove confederate flags , healthcare for all , legalize gay marriage . # semst",NONE,Positive,atheism
"i do n't know which i 'm more surprised by , the usa or ireland , for their action on gay rights . # lgbt # usa # ireland # semst",NONE,Negative,atheism
"the world was made a better place today , even if it was on a small scale , it was a small step forward . # semst",NONE,Positive,atheism
"in other news , this week foxnews lost half its viewers due to heart attacks . well , at least they have obamacare . # unitebiue # semst",NONE,Negative,atheism
"on a terrible day elsewhere , president obama 's beautiful , inspiring words on gay marriage are so welcome # equality # hope # semst",NONE,Positive,atheism
@ whitehouse @ potus # imagine no religion . there 's no god . loving one another unconditionally is what matters . wtg usa ! # lovewins # semst,FAVOR,Positive,atheism
# newsalert from heaven : in an effort to minimize the workload # god decides to only answer # gay # prayers # criticalthinking # semst,AGAINST,Negative,atheism
"our country is finally moving beyond outdated , religious definitions of marriage . @ royspeckhardt @ americnhumanist # marriage # semst",FAVOR,Positive,atheism
"now , let 's get scotus to rule that `` under god '' on the currency violates the establishment clause . # freethinker # semst",FAVOR,Negative,atheism
our country always had `` legal '' acts that 've been `` illegal '' according to god 's law keep your eyes & service on the only real judge ! # semst,AGAINST,Positive,atheism
"idc what the bible says , constitution says you can take it and shove it right back where it came from .. we are n't a theocracy . # semst",FAVOR,Negative,atheism
today is the day we finally join other free nations in celebrating equality for all . long overdue . # lovewins # semst,NONE,Positive,atheism
"a win for health care , a win for love . it 's been a good two days . # semst",NONE,Positive,atheism
@ wolfblitzer when r u going to get some balls & stand up against the insanity of god worship . # fuckreligion # fuckjesus # semst,FAVOR,Negative,atheism
@ wolfblitzer when r u going to stand up against the stupidity of faith ; belief w/o evidence ? # fuckreligion # fuckjesus # semst,FAVOR,Negative,atheism
"a defining moment for the u.s. yes , but even more so for the human species . we continue to march forward . # proudtolove # lovewins # semst",NONE,Positive,atheism
fruity pebbles might just be the perfect breakfast today . : ) # lovewins # loveislove # scotusmarriage # loveneverfails # pride2015 # semst,NONE,Positive,atheism
a big muah to everyone in america ! # lovewins # marriageequality # semst,NONE,Positive,atheism
i 'm so proud of the u.s. let 's keep the momentum going and make more progress for all . # lovewins # semst,NONE,Positive,atheism
"do nothing for # god , do everything for humans . # freethinker # lovewins # semst",FAVOR,Other,atheism
we all end to come out ! # diversity be who you are . # semst,NONE,Positive,atheism
today makes me really happy because we are one step closer to full equality in america # semst,NONE,Positive,atheism
i know why he has to do it . given the audience and the events . but the god talk in president obama 's speech jars with me . a lot . # semst,FAVOR,Negative,atheism
i am strong because i am wise and full of knowledge -prov . 24:5 # semst,AGAINST,Positive,atheism
graveyards owned by the local authority are available to people of all religions or none . # semst,NONE,Positive,atheism
"@ dragonflyjonez @ gkjill yeah , well , he was n't a fan of gay marriage a few years ago , so let 's just see how this goes , ok ? # semst",NONE,Negative,atheism
defend me from those who rise up against me -ps . 59:1 # semst,AGAINST,Positive,atheism
"atheism involves what a person does or does not believe , agnosticism involves what a person does or does not know . # waterford # semst",NONE,Other,atheism
one do n't have to kill the old ones for a newly born ! # life # humanity # semst,NONE,Negative,atheism
@ govmikehuckabee read article 11 of the tripoli treaty in which pres . john adams makes clear america is not a christian nation # semst,FAVOR,Negative,atheism
@ the_bodd i can see why it 's deleted lol # lovewins # reasonoverreligion # semst,FAVOR,Positive,atheism
"just because the supreme court grants something , does n't make anything equal . equality , like anything else , is matter of the heart . # semst",NONE,Other,atheism
today i am glad to have one more reason to be proud of the country i live in : ) # lovewins # lgbt # scotus # freedom # semst,NONE,Positive,atheism
@ frmatthewlc ... or maybe random shit happens to everyone regardless of whether or not they have a make-believe friend . # semst,FAVOR,Negative,atheism
"@ choosetobfree @ xfranman @ nbcnews thomas jefferson & george washington did not believe in an afterlife , thomas paine was atheist # semst",FAVOR,Other,atheism
imagine how amazing the world would be without religion . no wars . no hate ( religion wise ) . no extremist . # semst,FAVOR,Positive,atheism
@ choosetobfree @ xfranman read a book that is n't about a burning bush and maybe you 'll learn something # lovewins # semst,FAVOR,Negative,atheism
@ xfranman old age has not made you any wiser or more mature . for shame ! # semst,NONE,Negative,atheism
most people need love and acceptance a lot more than they need advice . - bob goff # inspiring # quote # lovedoes # love # christian # semst,AGAINST,Positive,atheism
have you sensed the summons to your journey ? # spirituality # semst,AGAINST,Positive,atheism
sagar wadekar on spirituality : have you sensed the summons to your journey ? # spirituality # semst,AGAINST,Positive,atheism
"@ wbcsaysrepent how do you feel now you evil , hompohobic , hypocritical , lying bunch of lunatics ? you lost . god lost . love won . # semst",FAVOR,Negative,atheism
come out of every circle of limitation and affliction in jesus ' name . # solutionnight # goodthing # semst,AGAINST,Positive,atheism
"# thebriefcase ignorant , fanatical pieces of shit should n't be glorified on television . disgusting . # semst",NONE,Negative,atheism
very excited that the # scotus ruled in favor of # marriageequaility # lovewins # semst,NONE,Positive,atheism
humanist canada stands by the us supreme court ruling in favor of marriage equality ! # lovewins # loveislove # marriageequaility # semst,NONE,Positive,atheism
# columbiahonraasrisri yet his own country # bharat does n't value @ srisri 's contribution cos it is # semst,NONE,Negative,atheism
"did n't do what i came out to do today , but god always has a plan # trust # godisgood # semst",AGAINST,Positive,atheism
if i get this one job in charlotte i 'll be good # semst,NONE,Positive,atheism
it looks like very soon homosexuality will only be illegal in islamic states . # semst,NONE,Positive,atheism
@ irenesconcierge i doubt that . the other day two libyan soldiers raped a guy in england while on a training mission . # semst,NONE,Negative,atheism
"1 holy mary mother of god , pray for us sinners now and at the hour of our death . amen . # rosary # teamjesus # semst",AGAINST,Negative,atheism
thankful for another day of this awesome life god has given us : ) # peace # thankful # goodfather # abundant # joy # life # goodness # semst,AGAINST,Positive,atheism
you stick in the postcode on where you want to go and god will set the satnav onhow to get there @ davegilpin @ hopecity # destiny # semst,AGAINST,Positive,atheism
"after all , is football a game or a religion ? ~howard cosell # semst",NONE,Negative,atheism
@ gregabbott_tx which god ? yours ? not mine . oh wait i do n't have one . # lovewins # semst,FAVOR,Negative,atheism
"from the fear of being suspected , deliver me , jesus . # catholic # semst",AGAINST,Positive,atheism
"jesus christ is the same yesterday , today & forever ! he is the only constant ! he 's never failed anybody . # faithful # friend # father # semst",AGAINST,Positive,atheism
all we need is to go back to our roots and get closer to nature . # simplelife # liveeasy # foodforall # goslow # semst,NONE,Positive,atheism
"never give up , you beautiful fuckers . # optimism # motivationaldemotivational # semst",NONE,Positive,atheism
exodus 20:3-4 you shall have no other gods before me . you shall not make for yourself an image in the form of anything . # semst,AGAINST,Positive,atheism
mercy lifted me up from a broken road so that i may live with a greater purpose # semst,AGAINST,Positive,atheism
rt @ introvertangry : too much # minorityappeasement in india . no room for # semst,NONE,Negative,atheism
"@ patrickclare1 in alberta , she could receive abstinence misinfo & shame in a public school and be forced to pray . # abed not # semst",FAVOR,Negative,atheism
"in the fear of the lord there is strong confidence , and his children will have a place of refuge . proverbs 14:26 # semst",AGAINST,Positive,atheism
looks like i lost about ten followers yesterday . # lol # bye # lovewins # semst,NONE,Negative,atheism
you ca n't reason with crazy . you are crazy just for trying . damn ! i guess we are all crazy . # humans # semst,NONE,Negative,atheism
remeber ... the difference between stumbling blocks and stepping stones ... is how you use them . # servantleader # leadership # semst,NONE,Positive,atheism
god is so good ! all the praises go up to him ! # semst,AGAINST,Positive,atheism
how to be a happy camper ? competency autonomy mastery purpose engagement relationships create well being/meaning # 100aeuassembly # semst,NONE,Positive,atheism
"the christian is not defined by the absence of sin , but by the presence of repentance . @ gospel_project # gospel # semst",AGAINST,Positive,atheism
nothing lies beyond the reach of prayer except that which lies outside the will of # god . ~unknown # quote # teamjesus # semst,AGAINST,Positive,atheism
take your # destiny out of the hands of people & place it in the hands of god . # semst,AGAINST,Positive,atheism
people keep asking if i 'm going to be a vicar so much i 'm scared it might actually happen # christianvocations # theology # help # semst,AGAINST,Negative,atheism
fallacies do not cease to be fallacies because they become fashions . g.k. chesterton # trends # fads # fashions # temporal # semst,NONE,Positive,atheism
religious leader 's pay depends on convincing you that their pile of superstitions is actually true . # freethinker # semst,FAVOR,Negative,atheism
it will never get old to hear when christians lead others to ultimate love & hope ! # disciples # share # gospel # jesuschangeseverything # semst,AGAINST,Positive,atheism
"i see more and more people each day question god 's work and why he does things . if you believe , you should n't have any questions . # semst",AGAINST,Positive,atheism
"st. philomena , invincible champion of chastity , pray for us . # catholic # semst",AGAINST,Positive,atheism
this is the day that the lord has made . let us rejoice and be glad in it ! ! ! ! # sunday # semst,AGAINST,Positive,atheism
"if you look around you , there is much to be enraptured by . be awake . # spirituality # semst",AGAINST,Positive,atheism
keep the faith . the most amazing things in life tend to happen right at the moment you 're about to give up hope . # semst,AGAINST,Positive,atheism
@ terrybrown5367 except for ( possibly ) craig stephen hicks . # chapelhillshooting # semst,NONE,Other,atheism
"god did n't call us to change people , that 's his job . he called us to share the gospel . # semst",AGAINST,Positive,atheism
"god is faithful , his gospel is powerful , and the spirit is transforming . # church # sunday # semst",AGAINST,Positive,atheism
they were all filled with the holy spirit and began to speak in foreign tongues as the holy spirit prompted them to speak # semst,AGAINST,Positive,atheism
i 'm not reading that mother fucking book because a human wrote it ! # religiousfreedom # humanslie # semst,FAVOR,Negative,atheism
@ amymek the establishment clause sets our country apart and prevents the radical religious zealots from taking charge . respect it # semst,FAVOR,Positive,atheism
@ moealqadi why # buddhism works ! we except all as they r. no judgement mexican-american # socialjustice # worldpeace # happy # freedom # semst,AGAINST,Positive,atheism
it was a lot of fun hearing @ sethandrewstta talk about his new book # sacredcows . @ thinkingatheist # godlessgala # semst,FAVOR,Positive,atheism
shout it from the mountain tops . scream out his name in praise . you do n't have to be a christian or go to church to worship # semst,AGAINST,Positive,atheism
rt @ letha_hughes : a belief in a cruel god makes a cruel man . ~ thomas paine # christianity # islam # sacrilegesu ... # semst,FAVOR,Negative,atheism
@ lavenderpurpleg an hour ? you need to buy better weed @ l1ght3n # weed # semst,NONE,Negative,atheism
"happy sun 's day my friends . if any of you find god , sit down , breathe deeply and count to 10 , you 're having a delusion , it 'll pass . # semst",FAVOR,Negative,atheism
proud of how many multi colour profile pictures i have been seeing on social media over past 3 days . awesome view : ) # lgbtrights # semst,NONE,Positive,atheism
i am against religion because it teaches us to be satisfied with not understanding the world . - @ richarddawkins # semst,FAVOR,Negative,atheism
"verily , verily , i say unto you , the servant is not greater than his lord ... john 13:16 kjv # lordoflords # kingofkings # semst",AGAINST,Negative,atheism
a pair of hands working 2gether is far better than a thousand hands clasped in prayers .. ! ! # freedomfromreligion # semst,FAVOR,Positive,atheism
"oh jesus , we write songs to praise you. # songwriters # wewrite # songs # praiseyou # semst",AGAINST,Positive,atheism
religion is the recognition of all our duties as divine commands . ~immanuel kant # semst,AGAINST,Positive,atheism
"no prayer is useless , wasted , or unheard ! # powerofprayer # semst",AGAINST,Positive,atheism
good morning . praise the lord ; for his mercy endures forever ! ! ! # repent # usa # jesusislord # hallelujah # praisethelord # homosexuality # semst,AGAINST,Positive,atheism
"we think the message will offend people , but we must tell the # truth of god 's word , it has the # power to change lives . # semst",AGAINST,Positive,atheism
i like how i 'm banned from the ffaf ( freedom from atheism foundation ) on facebook . i guess i was too harsh in my comments .. # semst,AGAINST,Negative,atheism
thoughts go out to family who have lose someone in tunisia shooting . so glad they shot him down on the spot ! # terrorist # tunisia # semst,NONE,Positive,atheism
"happy # sundayfunday , mortals ! # lovewins & @ govmikehuckabee loses . honestly ? # icouldusealittlemorecowbell ! # fsm # atheists # semst",FAVOR,Other,atheism
74 aspiring # warriors joined us for a chat on morals . the # scotusmarriage decision featured heavily in this topic . # lovewins # semst,NONE,Positive,atheism
"on balance , religion does more harm than good . # freethinker # semst",FAVOR,Negative,atheism
you 'd be blind not to see that this amazing moment in time is not being celebrated by religious zealots . # lovewins # semst,FAVOR,Positive,atheism
"moral landscape of this age = 7 billion reflections , 7 billion personal ideas , 7 billion pleasures & 7 billion comforts . # bankrupt # semst",NONE,Negative,atheism
"before any african american goes to church , they should realize that their make believe god supported their slavery . # semst",FAVOR,Negative,atheism
"before going to church , african americans should realize that their make believe god supported slavery . # confed2015 # semst",FAVOR,Negative,atheism
take hold of your authority in christ ! take back what the enemy has stolen ! # authority # life # calling # semst,AGAINST,Positive,atheism
"# lord jesus , you are altogether lovely ! o lord # jesus , you are altogether lovely ! -lifeandbuildingasportrayedinthesongofsongs # semst",AGAINST,Positive,atheism
saw @ chembros at the essential festival in brighton too # khole # semst,NONE,Other,atheism
growing up watching david attenborough is part of the reason i feel the way i do about our planet and my despising of religion . # semst,FAVOR,Negative,atheism
i hate it when i try to create something new and get shut down by something old . # syfy # creative # life # semst,NONE,Negative,atheism
religion is like a booger on the face of the earth . atheists have the tissues . # church # god # pray # semst,FAVOR,Negative,atheism
"i will not lack favor for my life , for with favor the lord will surround me as a shield -ps . 5:12 # semst",AGAINST,Positive,atheism
"# u2ietour wish the lads would 've matured past christianity , like i did . but i got a science education . they did n't . sotheyr stuck . # semst",FAVOR,Negative,atheism
"light is not called into light , its called into darkness ! why fear if christ is leading you ? # chicago # newyork # miami # semst",AGAINST,Positive,atheism
@ _kissmysassyass and you do n't support equality because of a myth ... something has got you all messed up . # semst,NONE,Negative,atheism
"@ abbswinston @ charlesfrith religion its all bloody man made & causes mankind to be so hateful & to control each other , give us # semst",FAVOR,Negative,atheism
"we love not by finding a perfect person , but by learning to see an imperfect person perfectly . # love # semst",NONE,Positive,atheism
blessed is he who comes in the name of the lord . from the house of the lord we bless you . psalm 118:26 # semst,AGAINST,Positive,atheism
"bible expo ! here at truthcaster , com please come . thanks ! # bible # expo # truths # semst",AGAINST,Positive,atheism
the dominance of # islam becomes evident when a smartphone types # ramayana as # ramadan . allah hu akbar ! # semst,AGAINST,Negative,atheism
daily time in god 's word yields lasting freedom . # assurance # semst,AGAINST,Positive,atheism
@ hijabismile @ nainfidels @ captains_pick @ pinchey1964 both are utterly stupid and useless anyway . # liberalism # democracy # semst,NONE,Negative,atheism
"@ swiss is proud to announce @ shelleysegal will be guest of honor at this year 's halloween party , and hunger task force food drive . # semst",NONE,Positive,atheism
"@ narrowwaychurch if u discriminate based on ur religion , be ready to be discriminated against for having that religion . @ pookstahr # semst",FAVOR,Negative,atheism
"rt @ marlamccarthy : if you know that god 's hand is in everything , you can leave everything in god 's hand . rest in him . # peace # rest # semst",AGAINST,Positive,atheism
jesus performed great miracles some people still could not believe him . because they did not believe him they had no faith belief is # semst,AGAINST,Positive,atheism
shivaji maharaj had 700 pathans . 35 % muslim soldiers . two muslim bodyguards . stop glorifying him as anti muslim u idiot bhakts ! ! # semst,NONE,Negative,atheism
so dumb that politicians in the u.s. are obligated to sprinkle in religious language when talking to constituents # semst,FAVOR,Negative,atheism
peace i leave with you ; my peace i give to you . | john 14:27a | # semst,AGAINST,Positive,atheism
faithful he has been . faithful he will be . # semst,AGAINST,Positive,atheism
"just for today , help me , god , to remember you . let this be a good day , god , full of joy and love . amen . # god # semst",AGAINST,Positive,atheism
the enemy will not be threatened by your faith until you decide to live by it . # semst,AGAINST,Positive,atheism
"i took my troubles to the lord : i cried out to him , and he answered my prayer . psalm 120:1 # signposts # powerofprayer # semst",AGAINST,Positive,atheism
"2/2 if you have adequate numbers , pls consider estab . volunteer fire pickets # whoisburningblackchurches # semst",NONE,Other,atheism
( it 's just a night watcheasy to set up . staggered pickets ( google it ) work best ) # whoisburningblackchurches # semst,NONE,Negative,atheism
you have to believe that # god is in control . that means there is no need to be stressed out and worried . # semst,AGAINST,Positive,atheism
both gods and religion where made up by some folks in antiquity to help explain things . # freethinker # semst,FAVOR,Negative,atheism
"1 corinthians 13:13 `` so now faith , hope , and love abide , these three ; but the greatest of these is love . '' # god # love # hope # bible # semst",AGAINST,Positive,atheism
the god named `` god '' is really just another god . # freethinker # semst,FAVOR,Negative,atheism
"it is our choices that show who we truly are , far more than our abilities . - albus dumbledore , harry potter # humanist # semst",NONE,Positive,atheism
any sane person who advocates positive change in the world would be against religion . it 's easy to see the damage it does . # semst,FAVOR,Negative,atheism
thou shalt not boil a kid in its mother 's milkexodus23:19 thank god i 'm an atheist ! # fundamentia # bibleverses # god # christianity # semst,FAVOR,Negative,atheism
"because he has inclined his ear to me , therefore i will call upon him as long as i live ps 116:2 # semst",AGAINST,Positive,atheism
# whatiknowaboutislam helped me 2 find the truth in other religions # christianity # buddhism # judaism & in # semst,AGAINST,Positive,atheism
@ antgerrard86 it is . faith means believing in something without evidence and with that you can justify anything . # scary # semst,FAVOR,Negative,atheism
